{
  "jobId": "eyvan-luxury-architecture-brief-001",
  "topic": "How material decisions shape a refined residential interior",
  "languages": ["en", "fa"],
  "status": "ready",
  "sourcePolicy": "owner_sources_only",
  "skillId": "eyvan-article-publishing-v1",
  "sourceLinks": [],
  "requestedBy": "Farnaz Ghaffarian",
  "createdAt": "2026-09-06T00:00:00.000Z"
}
